{
  "outcome_id": "out-2026-10-18-0001",
  "candidate_id": "cand-m1-0001",
  "feedback_refs": [
    "fb-2026-10-18-0001"
  ],
  "actual_use": null,
  "observed_outcome": {
    "status": "UNKNOWN",
    "statement": null,
    "evidence_refs": []
  },
  "benefit_judgement": "NOT_EVALUATED",
  "recorded_at": "2026-10-18T04:00:00+08:00",
  "contract_version": "1.0"
}
